{
  "schema_version": "1.0",
  "producer": {
    "plugin_name": "example-game-plugin",
    "plugin_version": "1.3.0",
    "game_build": "20260731.1",
    "boot_id": "boot-019fd684-55ce-7b63"
  },
  "sent_at": "2026-07-31T00:10:23.000+08:00",
  "events": [
    {
      "event_id": "019fd684-55ce-7b63-a648-4fead2410101",
      "sequence": 101,
      "event_type": "session.started",
      "status": "succeeded",
      "occurred_at": "2026-07-31T00:10:00.100+08:00",
      "server_tick": 8800100,
      "actor": {
        "player_id": "10001",
        "account_id": "account-11",
        "character_id": "10001",
        "session_id": "session-781",
        "device_fingerprint": "hmac-sha256:example-device-digest",
        "client_ip": "192.0.2.10"
      },
      "context": {
        "action_code": "login_success",
        "client_version": "1.72.4",
        "map_id": "map-1000"
      },
      "data": {
        "metadata": {
          "gateway_id": "gateway-1",
          "login_method": "password"
        }
      }
    },
    {
      "event_id": "019fd684-55ce-7b63-a648-4fead2410102",
      "sequence": 102,
      "event_type": "state.player_snapshot",
      "status": "succeeded",
      "occurred_at": "2026-07-31T00:10:00.150+08:00",
      "server_tick": 8800150,
      "actor": {
        "player_id": "10001",
        "account_id": "account-11",
        "character_id": "10001",
        "session_id": "session-781"
      },
      "context": {
        "reason_code": "login_snapshot",
        "map_id": "map-1000",
        "position": { "x": 118.5, "y": 92.0 }
      },
      "data": {
        "player_state": {
          "online": true,
          "in_combat": false,
          "level": 165,
          "map_id": "map-1000",
          "position": { "x": 118.5, "y": 92.0 },
          "currencies": {
            "game_cash": "20005154",
            "gold_coin": "5000",
            "silver_coin": "200000000"
          },
          "inventory_digest": "sha256:example-inventory-digest"
        }
      }
    },
    {
      "event_id": "019fd684-55ce-7b63-a648-4fead2410103",
      "sequence": 103,
      "event_type": "ledger.reward_granted",
      "status": "succeeded",
      "occurred_at": "2026-07-31T00:10:05.220+08:00",
      "server_tick": 8805220,
      "transaction_id": "reward-daily-20260731-10001-1",
      "actor": {
        "player_id": "10001",
        "account_id": "account-11",
        "character_id": "10001",
        "session_id": "session-781"
      },
      "context": {
        "action_code": "daily_reward_commit",
        "reason_code": "daily_quest_reward",
        "source_type": "quest",
        "source_id": "daily-quest-77",
        "config_version": "reward-table-20260731.1"
      },
      "data": {
        "currency_changes": [
          {
            "owner_id": "10001",
            "currency": "gold_coin",
            "before": "5000",
            "after": "6000",
            "delta": "1000",
            "balance_version": "balance-811"
          }
        ],
        "asset_changes": [
          {
            "asset_id": "item-019fd684-reward-0001",
            "asset_kind": "item",
            "operation": "create",
            "template_id": "item-xtl-01",
            "name": "玄天令",
            "quantity_before": 0,
            "quantity_after": 1,
            "owner_before": "",
            "owner_after": "10001",
            "container_before": "system",
            "container_after": "bag",
            "slot_before": -1,
            "slot_after": 105
          }
        ],
        "metadata": {
          "claim_id": "claim-20260731-10001-1",
          "daily_claim_count": 1,
          "configured_max_count": 1
        }
      }
    },
    {
      "event_id": "019fd684-55ce-7b63-a648-4fead2410104",
      "sequence": 104,
      "event_type": "ledger.currency_changed",
      "status": "succeeded",
      "occurred_at": "2026-07-31T00:10:08.010+08:00",
      "server_tick": 8808010,
      "transaction_id": "mall-order-44281",
      "actor": {
        "player_id": "10001",
        "account_id": "account-11",
        "character_id": "10001",
        "session_id": "session-781"
      },
      "context": {
        "action_code": "mall_purchase_commit",
        "reason_code": "mall_purchase",
        "source_type": "mall_order",
        "source_id": "mall-order-44281",
        "config_version": "mall-catalog-20260731.2"
      },
      "data": {
        "currency_changes": [
          {
            "owner_id": "10001",
            "currency": "gold_coin",
            "before": "6000",
            "after": "5672",
            "delta": "-328",
            "balance_version": "balance-812"
          }
        ]
      }
    },
    {
      "event_id": "019fd684-55ce-7b63-a648-4fead2410105",
      "sequence": 105,
      "event_type": "ledger.asset_moved",
      "status": "succeeded",
      "occurred_at": "2026-07-31T00:10:12.441+08:00",
      "server_tick": 8812441,
      "transaction_id": "warehouse-move-11991",
      "actor": {
        "player_id": "10001",
        "account_id": "account-11",
        "character_id": "10001",
        "session_id": "session-781"
      },
      "context": {
        "action_code": "warehouse_store_commit",
        "reason_code": "player_store",
        "source_type": "warehouse",
        "source_id": "warehouse-10001"
      },
      "data": {
        "asset_changes": [
          {
            "asset_id": "item-019fd684-reward-0001",
            "asset_kind": "item",
            "operation": "move",
            "template_id": "item-xtl-01",
            "name": "玄天令",
            "quantity_before": 1,
            "quantity_after": 1,
            "owner_before": "10001",
            "owner_after": "10001",
            "container_before": "bag",
            "container_after": "warehouse",
            "slot_before": 105,
            "slot_after": 3
          }
        ]
      }
    },
    {
      "event_id": "019fd684-55ce-7b63-a648-4fead2410106",
      "sequence": 106,
      "event_type": "ledger.trade_committed",
      "status": "succeeded",
      "occurred_at": "2026-07-31T00:10:18.200+08:00",
      "server_tick": 8818200,
      "transaction_id": "trade-9000281",
      "decision_id": "decision-7a22",
      "actor": {
        "player_id": "10001",
        "account_id": "account-11",
        "character_id": "10001",
        "session_id": "session-781"
      },
      "context": {
        "action_code": "player_trade_commit",
        "reason_code": "player_trade",
        "source_type": "trade",
        "source_id": "trade-9000281",
        "map_id": "map-1000"
      },
      "data": {
        "currency_changes": [
          {
            "owner_id": "10001",
            "currency": "game_cash",
            "before": "20005154",
            "after": "20010308",
            "delta": "5154",
            "balance_version": "balance-813"
          },
          {
            "owner_id": "10002",
            "currency": "game_cash",
            "before": "9000000",
            "after": "8994846",
            "delta": "-5154",
            "balance_version": "balance-302"
          }
        ],
        "asset_changes": [
          {
            "asset_id": "item-trade-example-9001",
            "asset_kind": "item",
            "operation": "move",
            "template_id": "item-xfxfs-01",
            "name": "特效仙风散",
            "quantity_before": 1,
            "quantity_after": 1,
            "owner_before": "10001",
            "owner_after": "10002",
            "container_before": "bag",
            "container_after": "bag",
            "slot_before": 12,
            "slot_after": 31
          }
        ],
        "metadata": {
          "counterparty_player_id": "10002",
          "same_device": true
        }
      }
    },
    {
      "event_id": "019fd684-55ce-7b63-a648-4fead2410107",
      "sequence": 107,
      "event_type": "security.validation_failed",
      "status": "rejected",
      "occurred_at": "2026-07-31T00:10:22.381+08:00",
      "server_tick": 8822381,
      "transaction_id": "reward-event-77-10001-2",
      "actor": {
        "player_id": "10001",
        "account_id": "account-11",
        "character_id": "10001",
        "session_id": "session-781"
      },
      "context": {
        "action_code": "reward_limit_check",
        "reason_code": "reward_overflow",
        "source_type": "activity",
        "source_id": "event-77",
        "config_version": "activity-77-v12"
      },
      "data": {
        "validation": {
          "rule_code": "reward_overflow",
          "severity": "critical",
          "message": "实际奖励数量超过配置上限，事务已拒绝",
          "expected": { "max_quantity": 2 },
          "observed": { "requested_quantity": 24 }
        }
      }
    }
  ]
}
